body,date,headline,img,priority,summary,thumbnail,url,cluster_no,sentiment
"What happened to the classic three course meal? Not so long ago it was the gold standard found everywhere from fancy restaurants to the weeknight dinner table. It’s time to bring it back in from the cold.  The three course meal dates back to ninth century Spain, when Persian polymath Ziryab no doubt infuriated the Emirati court in Cordoba by insisting meals be served as a soup, followed by a main dish, finishing with a sweet dessert. His fastidiousness aside, the idea certainly caught on, and it held near-complete dominance over how the western world ate for more than a thousand years. In the last few decades the three course meal has fallen on hard times. We began to obsess over convenience at home, and the idea of cooking more than one thing a day became the stuff of nightmares. Restaurants wanting to stand out from the crowd started serving a bewildering array of degustations, mini-degustations, small plates, big plates, sharing plates and tasting plates. It’s getting confusing, and now whenever a waiter approaches my table to “explain how the menu works” I let out a silent scream, the curmudgeon in me longing for a simpler time. It’s understandable why restaurants have distanced themselves from the tradition – new menu structures allow chefs to control ordering, reduce waste and increase how much the customer spends. And at home our the mindset has changed so that we now want to spend as little of our lives cooking as possible, leaving us more time to watch other people cooking on the telly. It almost seems like the three course meal is doomed, relegated to once-in-a-blue-moon Saturday night dinner parties, and hokey tourist traps in Paris’s sixth arrondissement. Even the darlings of the neo-bistrot movement, touted as the resurgence of French cuisine, seem to have left behind the prix fixe holy trinity of entree-plat-dessert. The likes of Le Chateaubriand, Frenchie and Bones all opt for four or five course menus in search of that little extra je ne sais quoi. I don’t think wanting three courses is simple nostalgia. There’s something very human about it. Playwrights and dramatists have followed the three-act structure of setup, confrontation and resolution for thousands of years, so perfect is its clarity of message. A three course meal tells a story with a beginning, a middle and an end, and when done well it resonates like the perfect pitch of a tuning fork. I rarely finish a good three-courser feeling anything other than comfortably satisfied. All is not lost. One champion of the three-course meal is London’s Dinner by Heston, Blumenthal’s throwback concept to the glory days of British food, such as they were, and it’s heartening to see how eagerly the dining public have taken to it.  It’s soared up world restaurant rankings on the back of rave reviews and now outranks his flagship, the Fat Duck. Another Dinner outpost will open in Melbourne in the coming months.  Sydney’s latest big opening, Peter Gilmore’s Bennelong at the Sydney Opera House, is distinguished by its three course a la carte offering giving theatre-goers the pleasure of a fine meal while finishing in time to see the curtain come up. Dinner’s runaway success could indicate that the three-course meal is not yet dead. We might still love the idea of sitting down to a meal with familiar structure, where food is served to please you rather than dazzle you.      Chefs Heston Blumenthal and Ashley Palmer-Watts, whose Dinner by Heston Blumenthal restaurant was the only UK one to make it into the top 10 of the World’s 50 Best Restaurants list this year. Photograph: Murdo MacLeod/Murdo MacLeod    Whether at a nice restaurant, down the pub or in your own kitchen, it would be a great shame if the institution of the three-course meal were to quietly slip away undefended. It’s time to bring it back. Adam’s three tips for making three course meals at home: 1. Cook in reverse If I’m making a three course meal at home, I’ll start by making a dessert that can be served straight from the fridge at room temperature, then a main course that can hold in the oven or on the stove. Finally I’ll prepare the entree just before it’s time to eat. It’s all about planning. 2. Spread it out If you’re going to eat three courses instead of one, you need to reduce the portion size for each course. If you’re used to eating a 300g steak for a one course dinner, try half that size for a three course main. I work on a 30:50:20 rule – 30% of the meal for the entree, 50% for the main course and 20% for dessert. 3. Learn the basics With a few basics up your sleeve, putting together three dishes is dead easy. Just add a meringue, and a few berries and cream become an Eton mess. A simple short pastry can turn anything in your fridge into a pie or tart. A vinaigrette dresses a few vegetables up as a perfect entree. The basics are what make ordinary ingredients a meal.",2015-07-17T04:34:37Z,Adam Liaw: bring back the three course meal,"<figure class=""element element-image"" data-media-id=""3b46bca3501ec922b1d3f4caaa4ff28d9e6b8dea""> <img src=""http://static.guim.co.uk/sys-images/Guardian/Pix/pictures/2015/7/17/1437098481131/11cd22ca-cbe4-421e-a9c2-f46a128d6e41-460x276.jpeg"" alt=""Forget small plates – Adam Liaw is a fan of the three-course meal."" width=""460"" height=""276"" class=""gu-image"" /> <figcaption> <span class=""element-image__caption"">Forget small plates – Adam Liaw is a fan of the three-course meal.</span> <span class=""element-image__credit"">Photograph: Destination Flavour, SBS Australia/Supplied.</span> </figcaption> </figure>",76,"Between sharing plates at restaurants and one-dish dinners at home, in the last few decades the three-course meal has disappeared. Adam Liaw argues it’s time to bring it back <br>",http://static.guim.co.uk/sys-images/Guardian/Pix/pictures/2015/7/17/1437098481421/a0c27117-b7d6-4879-9bf5-451712b46978-140x84.jpeg,http://www.theguardian.com/lifeandstyle/australia-food-blog/2015/jul/17/adam-liaw-bring-back-the-three-course-meal,3,positive
"Jalapeño – the very word raises the corners of my mouth to a pleasant smile. It wasn’t always this way, in fact years ago I’d be asking for an extra napkin after eating a vindaloo, for the beads of sweat on my forehead. People change, our palates evolve and mine seems to have been drawn to jalapeño. Maybe my taste buds are just worn out with age and require a bit of heat to get excited. What ever that case be, it’s jalapeño that I have affection for, so much so that I grow approximately 20kg of it every year. That’s a lot of chilli. I make many products with these little peppers, with much of it ending up in sauces like the fiery salsa picante, or the spicy harissa. I smoke them, which transforms jalapeño into chipotle, and ends up being added to cooking or turned into killer sauces. I also dry the jalapeño or roast it dry, then blitz it to make a hot chilli powder. It’s one less spice I need to buy.     Chillies grown in Rohan’s hothouse. Photograph: Rohan Anderson/Supplied.    In Australia there isn’t much variety in commercial chilli, which I reckon is a bit slack. The sheer variety in chilli is phenomenal, but it’s just not part of our culinary culture.  I have taken to a few other varieties like the birds eye, fire and habenaro, but it’s the ever reliable jalapeño that I keep returning to. For years I’ve experimented with differing varietals trying to find what matched the higher altitude, short summer climate. I was barking up the wrong tree with this experimentation. It wasn’t until a few summers ago when I built a poly tunnel was I able to successfully grow chillies.    Related: Alys Fowler: chillies    A poly tunnel – also known as hothouse – is a steel frame covered in special grade plastic that is often used by commercial florists and veg growers to capture the sun’s rays and create a controlled warm environment. Now, no longer did I have to be content with green chilli, for my poly tunnel extended the growing season a month either end of the summer growing period. The sunlight gets trapped in the plastic covered poly tunnel and heats up the soil and maintains a controlled growing environment without the need for a heater. As the days cool off the outside garden and soil cools too, and this would make growing a little harder for the chilli plants. But in the poly tunnel the warmth is trapped and the temperature remain consistent, replicating the environmental conditions used to grow chilli. The system works so well that right in the middle of winter I still have a few plants with fresh chilli hanging from them. Not only can I enjoy the heat and tang of a bottle of salsa picante in the middle of winter, but I can now add thinly sliced jalapeño to dress my scrambled eggs in the morning.  In my previous life, if I desired jalapeño on my eggs during winter, I would have gone to a supermarket and bought them from the fresh produce section. These supermarket chilli’s would have been grown in a warm climate (well over a thousand kilometres away) and trucked to my local supermarket, or they would have been grown in a massive commercial hothouse, heated by a diesel generator adding yet more carbon emissions to our already challenged atmosphere. I know the plastic tunnel of mine is not perfect, or free of environmental impact, but it gives me many years of service and grows a large portion of our food which makes sense to me.   Related: Hottest chillies in the world: the Scoville scale – in pictures    Over summer we get baskets of tomato, eggplant, zucchini, capsicum and all the chillies. In winter it houses broccoli, kale, peas, spinach, carrots ... you name it. Its functionality and reliability as a food producer is phenomenal. We end up knowing exactly what we’re eating and how it was grown. The best feature of growing my jalapeño crop in my poly tunnel is that I always seem to have a little more crop than I need, which means the excess ends up as the ultimate bartering commodity. I’ve recently swapped a basket of my chilli for smoked ham hock, bacon, toulouse sausage and chorizo. Spring isn’t really that far away, even though it did snow here last week. But give it a month of two and I’ll be found propagating another round of jalapeño seeds that will grow over the coming summer and bring us culinary joy all through next winter. ",2015-07-17T01:28:11Z,Australian food in (and out of) season: growing chillies in mid-winter,"<figure class=""element element-image element--showcase"" data-media-id=""5341b19a13d4c97b295a407703caac53300f4323""> <img src=""http://static.guim.co.uk/sys-images/Guardian/Pix/pictures/2015/7/16/1437023038858/36ed208c-5e15-402a-b081-ad94edb46298-460x276.jpeg"" alt=""chillies"" width=""460"" height=""276"" class=""gu-image"" /> <figcaption> <span class=""element-image__caption"">In a greenhouse you can grow chillies in the dead of winter.</span> <span class=""element-image__credit"">Photograph: Rohan Anderson/Supplied.</span> </figcaption> </figure>",77,"Jalapeños radiate with summer heat, but by building his own hothouse, Rohan Anderson is able to cultivate them in winter too<br>",http://static.guim.co.uk/sys-images/Guardian/Pix/pictures/2015/7/16/1437023039176/0280433a-6eea-40e3-bce8-ef97a9c7061a-140x84.jpeg,http://www.theguardian.com/lifeandstyle/2015/jul/17/australian-food-in-and-out-of-season-growing-chillies-in-mid-winter,2,positive
"Sydney’s Rockpool has been named best restaurant in the country in the Gourmet Traveller awards. Head judge Pat Nourse praised the flagship restaurant run by veteran chef Neil Perry. “You hear people telling you that fine dining is dead with the same predictable frequency that you hear the novel is dead, but just as people writing great books, people keep producing great restaurants. It’s a grown up restaurant, it’s an exciting restaurant. It doesn’t insult insult your intelligence.” Rockpool’s mains are around the $40-$50 mark and chefs work with local produce, giving it an Asian twist (for instance – roasted blue swimmer crab with fried garlic and fragrant udon noodles). A tasting menu of nine courses is $185. Nourse, who spent seven months (with a team of 60 reviewers) trying restaurants and bars around the country, praised Rockpool’s sommeliers and the “elegant, incredible dining room”. “The staff have a command of their material. Restaurant-craft for them is something innate – it’s in their bones. It’s not hospitality that’s been cribbed from the internet and practised in front of the mirror: you know as soon you walk through the door that it’s the real deal. You get the sense that everything will be taken care of.” Although there are Rockpool franchises in Melbourne and Perth, the Sydney original is the gold standard, says Nourse.   Related: Sepia in Sydney restaurant review – the decor is serious, the food is amazing    “Rockpool has always been Neil Perry’s baby. There is the clear sense that this is his flagship. It’s the creative engine that powers all his businesses – and a real creative engine for modern Australian dining, as a whole. You have this dialogue between Neil Perry, a veteran who still picks up the knives, and the head chef, a young gun called Phil Wood who knows how to push the boat out.” Australia’s Bar of the Year is Brisbane’s heritage listed space, The Gresham, while Regional Restaurant of the Year is Byron Bay newcomer Three Blue Ducks – who also operate a cafe in Bronte. Nourse said Melbourne had fewer “dynamic restaurant openings than Sydney this year” but Victoria scored gongs with Vanessa Crichton of Rosetta taking out Maître d’ of the Year, and Raffaele Mastrovincenzo from Kappo winning Sommelier of the Year. Dan Hunter, of Brae in country Victoria, took out the top spot in the peer-voted Chef of the Year award. New Restaurant of the Year award went to the newly refurbished Bennelong, at the Opera House. Billy Kwong, also in Sydney, won Wine List of the Year.   Related: Why the block of ice in your cocktail glass is as important as the booze you choose    Lennox Hastie, a chef who cooks only with fire at his Surry Hills restaurant, Firedoor, was named Best New Talent. “We’ve stretched the definition of ‘new’ a bit in Best New Talent; he’s been cooking for 15 years professionally, and has worked with some of the most famous chefs in Europe before finally opening a restaurant of his own here in Australia. The way these guys cook is like nothing else. It’s not big flavours, it’s not what this guy does. He uses smoke and fire with precision and delicacy. He’s cooking with pans made of mesh. He’s cooking over coals in what looks like a strainer.”     Some of Australia’s top chefs enjoy a feed at Wednesday night’s Gourmet Traveller awards. Photograph: Gourmet Traveller    A full list of the winners Restaurant of the year: Rockpool, Sydney, NSW Chef of the year: Dan Hunter, Brae, Birregurra Outstanding contribution to hospitality: Joost Bakker, sustainability activist New restaurant of the year: Bennelong, Sydney, NSW Wine list of the year: Billy Kwong, Sydney Sommelier of the year: Raffaele Mastrovincenzo, Kappo, Sydney Maitre d’ of the year: Vanessa Crichton, Rosetta, Melbourne Best new talent: Lennox Hastie, Firedoor, Sydney Regional restaurant of the year: Three Blue Ducks, Byron Bay, NSW Bar of the year: The Gresham, Brisbane Three star winners The Bridge Room, Sydney Sepia, Sydney Vue de Monde, Melbourne Momofuku Seiobo, Sydney Quay, Sydney Brae, Birregurra Attica, Melbourne Rockpool, Sydney",2015-08-20T02:54:22Z,Rockpool Sydney restaurant named the best in Australia by Gourmet Traveller,"<figure class=""element element-image"" data-media-id=""ff3aa8e182f64d71cb00a2c45b52705735c070d0""> <img src=""http://static.guim.co.uk/sys-images/Guardian/Pix/pictures/2015/8/20/1440035079750/7925fc4c-ad4f-48b9-a978-11264def81f2-460x276.jpeg"" alt=""The team from Rockpool celebrating their win."" width=""460"" height=""276"" class=""gu-image"" /> <figcaption> <span class=""element-image__caption"">The team from Rockpool celebrating their win.</span> <span class=""element-image__credit"">Photograph: Gourmet Traveller</span> </figcaption> </figure>",78,"After seven months and hundreds of meals, the team at Gourmet Traveller plump for a ‘grown up restaurant that doesn’t insult your intelligence’ <br>",http://static.guim.co.uk/sys-images/Guardian/Pix/pictures/2015/8/20/1440035080113/2ff0bff1-f3a0-468b-852f-13ea7ef9fc1a-140x84.jpeg,http://www.theguardian.com/lifeandstyle/australia-food-blog/2015/aug/20/rockpool-sydney-restaurant-named-best-in-australia-by-gourmet-traveller,1,negative
"It was time to undo my belt and beg forgiveness from my dentist. For the second year running, Sydney’s Shangri La hotel hosted Sweet Street, a four-hour extravaganza of sugar-coated, dusted, glazed, frosted dessert tastings. Some of Australia’s finest pastry chefs, confectioners and chocolatiers flew into town this month to put their most popular and kookiest creations on display. Guardian Australia took a trip into this Willy Wonka-esque sugar kingdom to discover the best, most innovative desserts available in Australia right now. Unmissable: Black Star’s Strawberry watermelon cake with rose-scented cream     Black Star’s strawberry watermelon cake. Photograph: Alexandra Spring/Instagram    About five years ago, Christopher Thé from Sydney’s Black Star Pastry came up with a novel idea for a wedding cake: layers of almond cake, whipped cream, a strip of fresh watermelon, pistachios, more cream, strawberries and dusted with edible rose petals. Despite the flamboyance of the ingredients, the cake was light, fresh and delicious and quickly became the cafe’s signature dish. Delicious! There was a long line to sample the classic cake.    Weird but it works: Andy Bowdy’s Nutella and cherry pie The foodie world is abuzz with the news that the pastry chef at the Sydney hipster eatery Hartsyard, Andy Bowdy, has gone out on his own with Andy Bowdy Pastry, an online bespoke cake service that will ship around Australia. Promised offerings include chocolate fudge cake with Milo mousse and salted caramel with Snickers wedding cakes.      One of Andy Bowdy’s chocolate fudge wedding cakes.    I tried the deep-fried Nutella and cherry pies which were yummier than they sound. The warm golden pastry pillows, dusted with cinnamon sugar, split open to reveal oozing Nutella and rich, ripe, dark cherries. Wonderful to eat – but could be a nightmare to ship.  The latest trend: eclectic eclairs from Cacao     Cacoa’s range of six original eclairs including the smores eclaire and the bacon and egg eclair.    According to chef Tim Clark, eclairs are the new macarons, and his Melbourne patisserie Cacoa has an eclair-only store to demonstrate just how much fun can be had by mixing up the flavour, texture and composition of the classic chocolate pastry.  For Sweet Street, Clark displayed six bizarre types that I had never encountered. There was an eclair with miso caramel custard, an eclair with raspberry creme and a chocolate “Astro boy” decal, a cereal eclair with cornflake cereal custard, an eclair with passionfruit and a milk chocolate Pokemon decal, and a bacon and egg eclair with egg custard and a strip of crispy maple bacon. I opt for the eclair with biscuit crackers and dark chocolate creme topped with a layer of charred marshmallow, toasted to order. In one bite, textures combine: it’s crunchy and creamy and sticky and chewy all at once. Confusing but somehow delicious.   Too cute to eat: LuxBite Kuma     LuxBite’s too cute to eat Kuma and curious Blue Calpis dessert.    Melbourne’s LuxBite specialises in desserts that combine Asian influences with French dessert techniques. There are two stores: the original LuxBite, which does macarons and cakes, and T by LuxBite, which specialises in tarts.  Bernard Chu and Yen Yee brought their four most popular desserts to the Sweet Street event. There was the blue Calpis, which is a white chocolate sponge with blueberry jelly and cream made from Japanese soft drink Calpis; the oversized raspberry endless love macaron, with lychee ganache and rose cream and a dark chocolate slice with a hazelnut crust and salted caramel dubbed epic chocolate cravings. My pick? The very kawaii-looking kuma, a teddybear-faced cookie cake with layers of strawberry, banana and chocolate milkshake mousse topped with caramel. Again, for all its decadence, it was surprisingly light, creamy and even a little citrusy.  Over the top: Adriano Zumbo’s Cereal Killer Zumbaron     Adriano Zumbo’s lime and twisties zumbarons. Photograph: supplied    Australia’s dessert king ever since he introduced the nation to the croquembouche (an eclair tower), Adriano Zumbo now has seven stores across Australia and an ever-changing menu of wacky “zumbarons” with flavours such as Vegemite and salted butter caramel on toast.  His palate-bewildering offerings include a salted butter popcorn choc top chouxmaca and a lime and cheese twisties zumbaron. Feeling positively Mr Creosote-esque (or Augustus Gloop) at this point, I opted for the cereal killer zumbarons – a pinky mauve macaron “coated in cornflakes, frootloops, Nutri-Grain and rice bubbles”. I felt like I was going to burst but I pushed on. With this many flavours at play, my palate could register only a wave of sickly sweetness and the realisation that it was time to lick my spoon one last time and bow out for the night. To make your own delicious desserts, follow our series.  ",2015-07-16T01:14:37Z,"Watermelon cake, fried Nutella pie, miso eclair: the most innovative cakes on offer this year","<figure class=""element element-image element--showcase"" data-media-id=""07297fd4cfb0a7a99a8e7baec778c95edcc90994""> <img src=""http://static.guim.co.uk/sys-images/Guardian/Pix/pictures/2015/7/14/1436874326374/f59c155a-001e-4ed3-ae7b-04f5dcffbffe-460x276.jpeg"" alt=""Black Star Strawberry Watermelon cake "" width=""460"" height=""276"" class=""gu-image"" /> <figcaption> <span class=""element-image__caption"">Black Star’s strawberry watermelon cake.</span> </figcaption> </figure>",79,Australia’s finest pastry chefs gathered at Sydney’s Sweet Street event to show their latest creations. But where does creative cooking meet crazy cake territory?,http://static.guim.co.uk/sys-images/Guardian/Pix/pictures/2015/7/14/1436874326688/758fc37c-abf3-4fd3-967e-1be7fc336012-140x84.jpeg,http://www.theguardian.com/lifeandstyle/australia-food-blog/2015/jul/16/watermelon-cake-fried-nutella-pie-miso-eclair-the-cakes-youll-be-eating-this-year,5,positive
