body,date,headline,img,priority,summary,thumbnail,url,cluster_no,sentiment
"If the amount of food wasted around the world were reduced by just a quarter there would be enough food to feed everyone on the planet, according to the UN.  Each year 1.3bn tonnes of food, about a third of all that is produced, is wasted, including about 45% of all fruit and vegetables, 35% of fish and seafood, 30% of cereals, 20% of dairy products and 20% of meat. Meanwhile, 795 million people suffer from severe hunger and malnutrition.  In developing countries there are high levels of unintentional wastage, often due to poor equipment, transportation and infrastructure. In wealthy countries, on the other hand, there are low levels of unintentional losses but high levels of “food waste”, when food is thrown away by consumers because they have bought too much or by retailers because it doesn’t look right.  Across the globe, initiatives such as food-sharing clubs and projects aimed at reducing post-harvest losses for poor farmers are making a difference.  We’d like to hear from people from around the world who are involved in preventing food wastage. Are there food loss initiatives in your community? Do you take part in a project that tackles food waste? We’d also like to hear how you prevent food waste in your own home - and to find out about your solutions to combat the problem.  You can share your photos, videos and experiences with GuardianWitness by clicking on the blue “Contribute buttons” on this article or with the new Guardian app – just search for GuardianWitness assignments. We’ll include the most interesting contributions in our reporting.   GuardianWitness is the home of user-generated content on the Guardian. Contribute your video, pictures and stories, and browse news, reviews and creations submitted by others. Posts will be reviewed before publication on GuardianWitness, and the best pieces will feature on the Guardian site. ",2015-08-12T06:00:16Z,Are you involved in preventing food wastage? Share your projects,"<figure class=""element element-image"" data-media-id=""2c62449bdb4543a3414da6e5d3b1cb51d5342139""> <img src=""http://media.guim.co.uk/2c62449bdb4543a3414da6e5d3b1cb51d5342139/0_0_2247_1348/1000.jpg"" alt=""Reducing food waste "" width=""1000"" height=""600"" class=""gu-image"" /> <figcaption> <span class=""element-image__caption"">Reducing food waste </span> <span class=""element-image__credit"">Photograph: Nick Ansell/PA</span> </figcaption> </figure>",0,We’d like to hear about projects that help reduce food loss and food waste from around the world. Spread the word about your initiatives with GuardianWitness<br>,http://media.guim.co.uk/2c62449bdb4543a3414da6e5d3b1cb51d5342139/0_0_2247_1348/140.jpg,http://www.theguardian.com/environment/2015/aug/12/are-you-involved-in-preventing-food-wastage-share-your-projects,0,positive
 ,2015-08-12T06:00:17Z,Produced but never eaten:  a visual guide to food waste,,2,"Whether the wastage is measured in tonnes of spoiled goods, hectares of agricultural land or household expenditure, the scale is frightening",http://media.guim.co.uk/990aef1856f14cf797ea686a18b44f754e064814/40_71_1972_1183/140.jpg,http://www.theguardian.com/environment/ng-interactive/2015/aug/12/produced-but-never-eaten-a-visual-guide-to-food-waste,7,positive
"If the amount of food wasted around the world were reduced by just 25% there would be enough food to feed all the people who are malnourished, according to the UN. Each year 1.3bn tonnes of food, about a third of all that is produced, is wasted, including about 45% of all fruit and vegetables, 35% of fish and seafood, 30% of cereals, 20% of dairy products and 20% of meat. Meanwhile, 795 million people suffer from severe hunger and malnutrition. Well-publicised attempts to combat the loss of food – such as recent laws in France that require supermarkets to distribute unsold food to charities – have highlighted the issue of food waste, identified by the UN as one of the great challenges to achieving food security. Estimates suggest that by 2050 food production will need to have increased by 60% on 2005 levels to feed a growing global population. Reducing food wastage would ease the burden on resources as the world attempts to meet future demand.   Related: Fighting food waste: four stories from around the world    The problem is global but manifests itself in starkly different ways. In developing countries there are high levels of what is known as “food loss”, which is unintentional wastage, often due to poor equipment, transportation and infrastructure. In wealthy countries, there are low levels of unintentional losses but high levels of “food waste”, which involves food being thrown away by consumers because they have purchased too much, or by retailers who reject food because of exacting aesthetic standards. In developed countries, consumers and retailers throw away between 30% and 40% of all food purchased, whereas in poorer countries only 5% to 16% of food is thrown away. According to a 2011 report, in Europe and North America each person wasted 95-115kg of otherwise edible food annually, whereas in sub-Saharan Africa and south and south-east Asia the equivalent waste was just 6-11kg. “In the developing world, food waste is virtually nonexistent,” says Robert van Otterdijk, coordinator of the UN Food and Agriculture Organisation’s Save Food programme.  “Food waste is happening in countries where people can afford to throw away food. One statistic is that the amount of food wasted by consumers in industrialised countries [222m tonnes a year] is almost the same as the total net food production of sub-Saharan Africa [230m tonnes]. “But food losses, on the other hand, are really rampant in developing countries because of the underdeveloped conditions they have, from management of production to transportation and distribution.”   Related: Produced but never eaten:  a visual guide to food waste    The environmental impact of food loss and waste is high. The carbon footprint of food produced and not eaten is estimated at 3.3 gigatonnes of CO2, meaning that if food waste were a country it would rank as the third highest national emitter of greenhouse gases after the US and China. About 1.4bn hectares, or close to 30% of available agricultural land, is used to grow or farm food that is subsequently wasted. And more surface and groundwater, or “blue water”, is used to produce wasted food around the globe than is used for agriculture by any single country, including India and China. “The whole issue of climate change has to do with our economy of production and consumption being out of balance with what the Earth can provide,” says Van Otterdijk. “Production of food is one of the biggest production sectors in the world, and if one-third of all this is just produced in vain you can imagine what a huge impact this has on the natural resources – on land, water, energy and greenhouse gas emissions.” The worst food waste offenders are the US, Canada, Australia and New Zealand, where consumers waste 39% of all food purchased, followed by Europe, where about 31% of all food purchased by consumers is thrown away. In the UK, 15m tonnes of food is lost or wasted each year. British consumers throw away 4.2m tonnes of edible food each year, equivalent in weight to 86 QE2s. This means that 11.7% of all food purchased is avoidably wasted, at an estimated cost to each family of £700 a year, or almost £60 a month. The foods most commonly found in British bins are bread, vegetables, fruit and milk. According to a nationwide analysis of food waste in UK households conducted by the food charity Wrap, the most wasted food in the UK by weight is bread, with consumers throwing away 414,000 tonnes (22.4%) of all bread purchased. By percentage, the most wasted food is lettuce and leafy salads, of which consumers throw away 38% (64,000 tonnes) of all they buy.  The most wasted meat, by both percentage and weight, is poultry, of which 13% of all edible parts (not including bones) is wasted, and the most wasted fruit by percentage is melon, with the equivalent of more than a quarter of each melon thrown in the bin. The UK has made progress in the past 10 years after a concerted campaign to reduce wastage. It is singled out by Van Otterdijk as “one of the great successes” in combating food waste.     For every 2 tonnes of food and drink consumed in the home, another tonne is going to waste at some point in the chain  David Moon, head of ​food ​​sustainability at W​rap UK     Between 2007 and 2012, the amount of avoidable food waste produced by UK households decreased by 21%, from 5.3m tonnes to 4.2m tonnes, largely due to greater awareness as a result of campaigns such as Wrap’s Love Food, Hate Waste. Of the food that is not eaten, less is ending up in landfill. In 2000-01, only 14% of household waste was recycled or composted, but by 2011-12 the amount of composted food had risen to 43%. “We have had feedback from people internationally that they do look to the UK as an example,” says Dr David Moon, head of food sustainability at Wrap UK. “But considering the levels of waste we have there’s considerably more to do. For every 2 tonnes of food and drink consumed in the home, there’s another tonne of food going to waste at some point in the chain – whether that’s production, retail or manufacturing.” Van Otterdijk says there has been a “very encouraging, unexpected, continuing interest” in the subject of food waste, enabling grass-roots campaigns around the world to gain traction. “We have to do much more and it needs the participation of public and private sectors,” he says. “But if it continues like this, with the same momentum, maybe after 10 years we’ll have globally significant results.” • This article was amended on 13 August 2015 to clarify a quote from the UN.",2015-08-12T06:00:17Z,"Cutting food waste by a quarter would mean enough for everyone, says UN","<figure class=""element element-image"" data-media-id=""3b305f8b9aa1f94efb474c1596f23064dbdf0c56""> <img src=""http://media.guim.co.uk/3b305f8b9aa1f94efb474c1596f23064dbdf0c56/0_0_3744_2568/1000.jpg"" alt=""Food waste "" width=""1000"" height=""686"" class=""gu-image"" /> <figcaption> <span class=""element-image__caption"">In developed countries, consumers and retailers throw away between 30% and 40% of all food purchased. </span> <span class=""element-image__credit"">Photograph: Murdo MacLeod for the Guardian</span> </figcaption> </figure>",3,"With the global population rising, wastage of products including 45% of all fruit and vegetables and 35% of fish and seafood is one of the greatest challenges to achieving food security",http://media.guim.co.uk/e804a4fc2b5c23c8da2d096a4d6cb730208c81f4/109_241_3278_1967/140.jpg,http://www.theguardian.com/environment/2015/aug/12/cutting-food-waste-enough-for-everyone-says-un,0,neutral
