body,date,headline,img,priority,summary,thumbnail,url,cluster_no,sentiment
"Recently the American website Ecowatch published an intriguing piece contrasting the fortunes of McDonald’s, criticised for not taking sustainability seriously enough and losing business, with Shake Shack, the fast-expanding cult burger chain with a more ethical approach. The reversal of those fortunes, it seems, is down to millennials, the generation born between 1982 and 2000, who are determined to spend their money in a way that does the planet less harm. This was backed up by the business magazine Forbes which declared that the highly developed social conscience of millennials would be a major driver of food sales for years to come. Even Monsanto has appointed a “director of millennial engagement”. Cheering, isn’t it? Young people seem to give a damn, especially about their lunch. But wait. Another report about the same age group suggests a good number don’t apply the ethics test to all their purchases. According to a Europe-wide study of drug habits, while marijuana use is in decline, it’s still the favoured drug of more than 12% of Britons aged 15-34. And coke is still used by more than 5% of twentysomethings. Anecdotally, those numbers get much higher in moneyed urban areas. The problem is that unless you’re buying from some hydroponics whizz working from a nearby attic, finding a local supply of grass is tough. And as yet no one has slapped a Fairtrade mark on cocaine. We appear to have a disconnect, albeit an understandable one. Buying ethically produced food, and making a statement about yourself by doing so, is now so easy it requires little or no thought. Thinking about where your narcotics come from, on the other hand, is so difficult it’s simply easier not to do so. Not that this is news to anybody who has floated around a street food festival recently. Along with the smell of Fairtrade coffee and locally reared pork how often have we sniffed the high tang of grass? In my case, regularly. We are, it seems, living in the age of the wonky moral compass: of middle-class couples who swear by their weekly organic veg box, and yet relax after dinner with a line of something produced by impoverished, subjugated Bolivian peasants. It’s the age of urban hipsters who Instagram their dinner until it’s begging for mercy, and finish their tweets with the hashtag #eatclean, but for whom a night out would be a failure if it hadn’t involved the contents of a plastic money bag. The novelist Don Winslow, chronicler of the west’s failed war on the Mexican drug cartels, put it best in an interview with Men’s Journal. “Twentysomethings now?” he bellowed. “God forbid they should buy anything but Fairtrade coffee, or locally grown pork... And yet they’ll think nothing of buying marijuana that has blood all over it – Central Americans kidnapped, made into slave labour, raped, murdered... It pisses me off beyond belief.” Me too, Don. Look, I’m not criticising other peoples’ lifestyle choices. And I’m hardly clean-handed. Until university and a bad mushroom trip, I did all the drugs, though I did try to avoid making false claims about my virtue. (In truth I revelled in my badness.) And of course, the majority of people who support Fairtrade or local are not off their gourd every Friday evening. I know that. But sometimes, when we’re being assailed with hipster rhetoric about healthy, ethical eating, perhaps we should remember that a Fairtrade flat white at £2.50 a cup is also a bloody cheap way by which to make a few false statements about yourself.",2015-08-19T10:59:03Z,Don’t bang on to me about ethical food if you still keep a stash of very unfairly traded weed,"<figure class=""element element-image"" data-media-id=""2e596b6e742eb69374047b719e1574be6c9349eb""> <img src=""http://static.guim.co.uk/sys-images/Guardian/Pix/pictures/2015/8/13/1439479028843/b6f6cc31-2008-4cd3-b62e-44d5e7fecf43-460x276.jpeg"" alt=""Cup of coffee with a fancy pattern in the foam"" width=""460"" height=""276"" class=""gu-image"" /> <figcaption> <span class=""element-image__caption"">‘God forbid twenty-somethings should buy anything but Fairtrade coffee’</span> <span class=""element-image__credit"">Photograph: Alamy</span> </figcaption> </figure>",25,Millennials and urban hipsters love the hashtag #eatclean – but do they apply the same standards to their grass and coke?,http://static.guim.co.uk/sys-images/Guardian/Pix/pictures/2015/8/13/1439479029178/b6f6cc31-2008-4cd3-b62e-44d5e7fecf43-140x84.jpeg,http://www.theguardian.com/lifeandstyle/2015/aug/19/dont-bang-on-to-me-about-ethical-food-if-you-still-keep-a-stash-of-very-unfairly-traded-weed,2,neutral
"The development of a greener, less wasteful health service is one of the cornerstones of the NHS’s improvement plan. Sonia Roschnik, head of the Sustainable Development Unit, which supports NHS, public health and social care services in England, says sustainability is a key part of the Five Year Forward View – the blueprint for the future of the health service – not just because it makes financial sense but because it is a health matter. “Sustainability is important for the NHS because climate change and the environment are going to impact on people’s health – whether that is air pollution leading to respiratory disease, or not eating good nutritious food,” she says. “There are a lot of links between high consumerism, unsustainable behaviours and impacts on health.”     apetito is committed to reducing its environmental impact. Illustration: theguardian.com    The NHS’s long-term strategy also requires adapting to climate change. “We already know the consequences of hot summers on wards,” adds Roschnik, “so we need to be better prepared for it.” Crucially, reducing the health service’s environmental impact goes beyond improving energy efficiency within its buildings or minimising the carbon footprint from transport. The NHS also needs to look at the procurement of vital services, such as food and medical supplies. One business already taking steps to help the NHS become a more sustainable health service is apetito. The catering company, which supplies food and services to more than 400 hospitals in the UK, is committed to reducing its environmental impact. Measures the business has already taken include only buying fish certified by the Marine Conservation Society and using sustainable palm oil. The company is also striving to reduce the amount of energy used at factory level, using solar energy to reduce its carbon emissions by 40% since 2007. The amount of food waste sent to landfill has been reduced to zero thanks to the business’s investment in an anaerobic digestion system, which converts the material into electricity. This green power now accounts for 5% of energy used in the factory. The diesel consumption of the company’s fleet of delivery vehicles has also been reduced by a third. apetito is conscious, however, that sustainability is not just about the environment – it’s about economic and social issues as well. That’s why the business currently pays 82% of its staff at least the national living wage and by next year says that will rise to 100%.     Musgrove Park’s progress on reducing food waste. Photograph: theguardian.com    Importantly, because all the meals are frozen, hospitals are able to make significant food waste savings. One of apetito’s clients, Musgrove Park hospital in Taunton, Somerset, reduced food waste from 21% to 5% after switching to cook-freeze meals. Feedback from patients has been overwhelmingly positive and the hospital scooped the Hospital Catering Association’s catering service of the year award earlier this year. Lee Sheppard, director of public policy and external affairs for apetito, says the company made the decision to focus more on sustainability eight years ago after a report from sector body the Food and Drink Federation revealed the company was sending more waste to landfill than previously thought. Sheppard says: “That was definitely a defining moment where we said, what are we going to do about this? What is the right sustainability model for us and that supports our customers? Where do we want to be and where do we need to be? What are the things that we need to start working on?”  Despite radically reducing waste and improving efficiency across the company’s operations, apetito is determined to build on its achievements and is creating a roadmap to help it meet sustainability objectives by the year 2020.  “We have had a lot of success around driving improvements around energy and waste, but what we now want to do is make sure that roadmap is embedded within our company values,” adds Sheppard. “We are looking at major factory development at the moment and the sustainability factors will be built in to every purchase decision we make there.”     Companies such as apetito are helping the NHS deliver a more sustainable health service. Photograph: theguardian.com    Companies such as apetito are helping the NHS deliver a more sustainable health service and the priority now is educating the sector about what sustainability really means and how this approach can benefit patient care. Scott Buckler, business development director for social enterprise 4AllofUs, organiser of the NHS Sustainability Day, says an increasing number of NHS trusts are becoming engaged in this agenda. He thanks the Five Year Forward View, which touches on prevention and sustainability, as a key driver for this change. Roschnik agrees that there is a growing appetite for sustainability in the NHS and would like it to be seen as just part and parcel of the way the health service is run. “It should become so natural that actually we don’t need to think about it,” she says. “That will take years and years to take effect but in a way it would be great if people could see that it is not so much of a challenge but more of a great opportunity because we can not only save money but improve health and save the environment.” Content on this page is paid for and produced to a brief agreed by apetito",2015-08-18T11:30:44Z,Why hospital catering company is focusing on sustainability,"<figure class=""element element-image"" data-media-id=""56a5c25f281dedd955a58d63274315b21b97b889""> <img src=""http://static.guim.co.uk/sys-images/Guardian/Pix/pictures/2015/8/11/1439295994861/d940de35-db45-4456-b1d2-7b5a8d3d703b-460x276.jpeg"" alt=""Solar panels"" width=""460"" height=""276"" class=""gu-image"" /> <figcaption> <span class=""element-image__caption""><em>apetito </em>has cut its carbon emissions by 40% since 2007 by using solar energy.</span> <span class=""element-image__credit"">Photograph: Terry Mathews /Alamy</span> </figcaption> </figure>",26,"For <em>apetito</em>, sustainability isn’t just about environmental initiatives, it includes economic and social issues too<br>",http://static.guim.co.uk/sys-images/Guardian/Pix/pictures/2015/8/11/1439295995207/d940de35-db45-4456-b1d2-7b5a8d3d703b-140x84.jpeg,http://www.theguardian.com/apetito-hospital-food-nutrition/2015/aug/18/why-hospital-catering-company-is-focusing-on-sustainability,0,positive
"Australia is a nation divided over tipping. In the US the rule is to add 15% to 20% to the bill. In the UK many restaurants add a 12.5% service charge – and if not, people normally tip about 10% unless the service was bad. Here in Australia the rules are there are no rules.  My sources in Australia’s upper-tier restaurants anecdotally report that more than half of customers tip. But what about in cafes or less high-end restaurants? Or for takeaway food? The most operators at the lower end of the spectrum can expect is pocket change or the bill rounded up a couple of dollars.   Related: Top tips on tipping around the world    The introduction of PayWave last year, where any transaction under $100 can be paid at an electronic remove, has accounted for a drop in tips across the board.  “I’d say the industry has definitely been affected,” says a restaurant veteran, John Kanis from the Lucas Group (Chin Chin, Kong and Baby, all in Melbourne). “Our staff had a big hit when it was first introduced, then as people got used to it the situation stablilised. I’d say tips are running at between 5% and 10% lower than before.  “But I go to places all the time that don’t even prompt you for a tip. They haven’t gotten over that hump, and I have to ask how to leave a tip. They’d be taking a much bigger hit.” So why tip? Is it the proper way to say thanks for a great time, polite acknowledgment of a difficult job, or simply because it’s a noble tradition? Jess Ho, the branding expert on Channel Seven’s Restaurant Revolution and owner of the South Melbourne wine bar Smalls, sees tipping as a weekly bonus rather than the raison d’être of the job. “I don’t do it for tips. I do it for hospitality,” she says. “But instead of a bonus a lot of people see it as a supplement to their wage. Either way you look at it, it encourages professionalism.” And what of tipping etiquette? Example: do you tip for takeaway? Answer: only if the waiter performed a magnificent feat, such as bagging the food in an aerodynamically-designed aluminium foil swan.  Or: should you tip bad service? Answer: no. Definitely not. That would make a mockery of the whole system. Tipping is for good service, although inveterate tippers would argue it’s for “good enough” service. While in the US tipping in the order of 15% to 20% is standard, the rough rule of thumb in Australia is 10%, although 5% will probably do in a cafe.  Can you tip individual waiters? Well, yes, you can choose to slip your server $20 at the end of the night and he or she can choose to pocket it, but restaurant etiquette generally demands it goes into the communal tip pool. Can you be sure it’s going to the waitstaff? Unfortunately you can’t, even though owners pocketing tips is illegal. It’s a game of trust, ruined in the breach by a minority. Do note, though, that the odds of your tip making it to the right people increase by leaving cash rather than a credit card gratuity. Furthermore, if you ever find a gratuity is included on the bill, you can refuse to pay it. You really needn’t tip on top of it unless service was so good it would have made angels weep.  So who tips in Australia? Ho says students “tend to either tip massively or not at all”. Tourists: “Yes, definitely.” Young families: no. The affluent – or at least those spending big – tend to be hit and miss. “If they go out of their way to say it was a really great night you know they won’t tip. I think it’s a way of overcompensating.” According to Kanis: “The bottom line is, you never can tell who’s going to tip and who isn’t.” He reckons it’s a good thing, too: “Restaurants are meant to be democratic places. If you could profile people it really wouldn’t be good for the industry.”  • Larissa Dubecki is a freelance food writer and restaurant critic. Prick with a Fork, a memoir of her decade as a waitress, is out through Allen &amp; Unwin on 26 August",2015-08-25T23:52:58Z,Tipping in Australia: what are the rules for rewarding waiters?,"<figure class=""element element-image"" data-media-id=""2d02bf7bcaa275bfcf62f1188bd148f5d36b1598""> <img src=""http://media.guim.co.uk/2d02bf7bcaa275bfcf62f1188bd148f5d36b1598/0_105_4271_2563/1000.jpg"" alt=""Tipping is a game of trust."" width=""1000"" height=""600"" class=""gu-image"" /> <figcaption> <span class=""element-image__caption"">Tipping is a game of trust.</span> <span class=""element-image__credit"">Photograph: Michael S Lewis/Corbis</span> </figcaption> </figure>",27,"Tourists are generous, young families less so. In a country where wages are robust and egalitarianism is prized, how comfortable are we with tipping?<br>",http://media.guim.co.uk/2d02bf7bcaa275bfcf62f1188bd148f5d36b1598/0_105_4271_2563/140.jpg,http://www.theguardian.com/lifeandstyle/australia-food-blog/2015/aug/26/tipping-in-australia-what-are-the-rules-for-rewarding-waiters,1,positive
"There’s only so much roasting and stewing you can do in the cold months before you want something that reminds you of summer. Fried chicken is the ultimate crossover food, equally at home topping a spicy winter laksa as it is next to summer coleslaw.  It’s also having something of a moment, with new hipster fried chicken joints opening with the same frequency that we saw in 2013 with the Mexican food revolution.    Malaysians and Indonesians love their chicken marinated in spices like turmeric and fried with pandan leaves    Nearly every culture has its own version of the dirty bird. Malaysians and Indonesians love their chicken marinated in spices like turmeric and fried with pandan leaves, which give it a unique herbal twang.  Americans brine then dredge their chicken in flour or batter, frying it in fat before dousing it liberally with hot sauce, gravy or cayenne pepper (more on that below).  Taiwanese enjoy fried chickens flat and large, while the Japanese take a more delicate hand with punchy karaage, schnitzel-like katsu and tempura styles.  Traditional crisp-skinned chicken from southern China juxtaposes soft tender flesh with a deeply tanned and lacquered visage, making it equally at home in a lunchbox or a lavish wedding feast. Then in Korea, perhaps the only celebrated legacy of the Korean war is its twice-fried Korean fried chicken, everyone’s friend after a drunken night. But it’s in the southern United States where fried chicken found its place in popular culture. The idea of frying chicken is said to have really caught on with Scottish immigrants who, as the story goes, consider frying to be almost a national sport. Chicken, like the Mars Bar decades later, worked well when cooked in hot lard, and so it rapidly became a staple in the new colonies where slaves from Africa added their own spin to it with their own seasonings and techniques.  Where the Brits might have boiled or baked their bird, it became the norm to fry it in the US, such that regional styles evolved dictating everything from sauces served alongside to batters, bastes and marinades. Then, in 1930, a former insurance salesman started serving his own version of fried chicken in a rent-free service station in Corbin, Kentucky. Pressure-fried to cook quickly, KFC’s 11 secret herb and spice-dusted chicken hit Australian shores in 1968 and is still going strong. KFC aside, where are the best new places in Australia to buy fried chicken? MelbourneBelle’s Hot Chicken in Fitzroy has to be the hottest place, literally, for the dirty bird right now. Their brined and flour-dusted chicken is fried in a secret blend of fats then doused with paprika and cayenne pepper at levels which range from mild to “really f**kin’ hot” in the style chef Morgan McGlone learned to cook in Nashville, where fried chicken is almost a religion. They’re planning another branch in Richmond, which should help ease the queues at mealtimes. CBD-based Gami Fried Chicken serves up crisp and zingy Korean-style bird. You’ll need to order ahead for Collingwood’s Rockwell &amp; Sons’ slow-brined fried chicken, which gets an extra coating of buttermilk and hot sauce when its served only on Wednesday nights. SydneySydney’s current buzz for fried chicken has been fuelled by the publication of Fried Chicken &amp; Friends, the debut cookbook from chefs Gregeory Llewellyn and Naomi Hart from Newtown’s Hartsyard (Murdoch Books, $49.95, Hardback). Here, the bird is brined then dipped in buttermilk – twice – before being fried and served with sausage gravy and lashings of their hot sauce. A sophisticated take on Korean fried chicken can be found at Redfern’s Moon Park, where buttermilk is blended with Malaysian shrimp sauce for a salt and umami-fuelled crunch.  Potts Point’s Ms.G’s takes their inspiration from Thailand, steeping their bird in curry paste before frying to a golden crunch.  Queues are the norm for Taiwanese-style fried chicken vendor Hot Star, who squish their chicken flat before crumbing, frying and then liberally dousing it with their signature spicy salt that manages to be both sweet and savoury at once. There’s eight locations – four in Sydney – with two in Melbourne plus one each in Adelaide and Sunnybank, Brisbane. ",2015-08-25T03:32:04Z,Fitzroy fried chicken and other delights: why the dirty bird is so hot right now,"<figure class=""element element-image"" data-media-id=""1458da2aab3860a73ea5fd255161406d1e7f9d0f""> <img src=""http://media.guim.co.uk/1458da2aab3860a73ea5fd255161406d1e7f9d0f/0_98_3648_2189/1000.jpg"" alt=""Fried chicken – perfect in a laksa or with coleslaw."" width=""1000"" height=""600"" class=""gu-image"" /> <figcaption> <span class=""element-image__caption"">Fried chicken – perfect in a laksa or with coleslaw.</span> <span class=""element-image__credit"">Photograph: Felicity Cloake for the Guardian</span> </figcaption> </figure>",28,Fried chicken is having a moment in Australia. Here’s where you should eat it and why <br>,http://media.guim.co.uk/1458da2aab3860a73ea5fd255161406d1e7f9d0f/0_98_3648_2189/140.jpg,http://www.theguardian.com/lifeandstyle/australia-food-blog/2015/aug/25/fitzroy-fried-chicken-and-other-delights-why-the-dirty-bird-is-so-hot-right-now,5,negative
